idx,opinion
C0,"Police forces, prison systems, and so-called ""justice"" are tools of oppression. Total anarchy is the only way to foster peace and love in society."
C1,"Abolish the police and the prison system; replace them with community-led ""restorative justice""."
C2,"Defund the police and reallocate funds to social workers and affordable housing."
C3,"Implement national standards for police body cameras and use of force while increasing training for de-escalation."
C4,"Maintain current police funding and standards."
C5,"Expand stop-and-frisk, increase police funding, impose stricter penalties for misdemeanors and felonies, and eliminate paroles."
C6,"Expand the death penalty, curtail prosecutorial discretion and woke policies, and deploy the National Guard to high-crime areas with authorization to use lethal force."
C7,"Implement an absolute law-and-order approach: summary executions for offenders of the law and deploying the military in high-crime areas."
C8,"Eliminating crime requires cutting it off at the root. Brain-computer interfaces to monitor people's thoughts and trigger emergency kill-switches are the only answer."